{
  "board": {
    "manufacturer": "NXP",
    "model": "FRDM-MCXN236"
  },
  "connectors": [
    {
      "connector_id": "J3",
      "display_name": "Arduino/FRDM/MC expansion header J3",
      "evidence_refs": [
        "guide-pinout-overview-01",
        "guide-pinout-detail-05",
        "guide-pinout-detail-06"
      ],
      "pin_count": 16,
      "pins": [
        {
          "aliases": [],
          "electrical_role": "gpio",
          "evidence_refs": [
            "guide-pinout-detail-05"
          ],
          "functions": [
            "MC"
          ],
          "number": 1,
          "signal_name": "P4_13"
        },
        {
          "aliases": [],
          "electrical_role": "not_connected",
          "evidence_refs": [
            "guide-pinout-detail-05"
          ],
          "functions": [
            "ARD"
          ],
          "number": 2,
          "signal_name": "NC"
        },
        {
          "aliases": [],
          "electrical_role": "gpio",
          "evidence_refs": [
            "guide-pinout-detail-05"
          ],
          "functions": [
            "MC"
          ],
          "number": 3,
          "signal_name": "P4_21"
        },
        {
          "aliases": [],
          "electrical_role": "power_rail",
          "evidence_refs": [
            "guide-pinout-detail-05"
          ],
          "functions": [
            "ARD"
          ],
          "number": 4,
          "signal_name": "P3V3"
        },
        {
          "aliases": [],
          "electrical_role": "gpio",
          "evidence_refs": [
            "guide-pinout-detail-05"
          ],
          "functions": [
            "MC"
          ],
          "number": 5,
          "signal_name": "P3_17"
        },
        {
          "aliases": [],
          "electrical_role": "reset",
          "evidence_refs": [
            "guide-pinout-detail-05"
          ],
          "functions": [
            "ARD"
          ],
          "number": 6,
          "signal_name": "RESET"
        },
        {
          "aliases": [],
          "electrical_role": "gpio",
          "evidence_refs": [
            "guide-pinout-detail-05"
          ],
          "functions": [
            "MC"
          ],
          "number": 7,
          "signal_name": "P3_16"
        },
        {
          "aliases": [],
          "electrical_role": "power_rail",
          "evidence_refs": [
            "guide-pinout-detail-05"
          ],
          "functions": [
            "ARD"
          ],
          "number": 8,
          "signal_name": "P3V3"
        },
        {
          "aliases": [],
          "electrical_role": "gpio",
          "evidence_refs": [
            "guide-pinout-detail-05"
          ],
          "functions": [
            "MC"
          ],
          "number": 9,
          "signal_name": "P3_15"
        },
        {
          "aliases": [],
          "electrical_role": "power_rail",
          "evidence_refs": [
            "guide-pinout-detail-05"
          ],
          "functions": [
            "ARD"
          ],
          "number": 10,
          "signal_name": "P5V0"
        },
        {
          "aliases": [],
          "electrical_role": "gpio",
          "evidence_refs": [
            "guide-pinout-detail-05"
          ],
          "functions": [
            "MC"
          ],
          "number": 11,
          "signal_name": "P3_14"
        },
        {
          "aliases": [],
          "electrical_role": "ground",
          "evidence_refs": [
            "guide-pinout-detail-05"
          ],
          "functions": [
            "ARD"
          ],
          "number": 12,
          "signal_name": "GND"
        },
        {
          "aliases": [],
          "electrical_role": "gpio",
          "evidence_refs": [
            "guide-pinout-detail-05"
          ],
          "functions": [
            "MC"
          ],
          "number": 13,
          "signal_name": "P2_7"
        },
        {
          "aliases": [],
          "electrical_role": "ground",
          "evidence_refs": [
            "guide-pinout-detail-05"
          ],
          "functions": [
            "ARD"
          ],
          "number": 14,
          "signal_name": "GND"
        },
        {
          "aliases": [],
          "electrical_role": "gpio",
          "evidence_refs": [
            "guide-pinout-detail-05"
          ],
          "functions": [
            "MC"
          ],
          "number": 15,
          "signal_name": "P3_12"
        },
        {
          "aliases": [],
          "electrical_role": "power_input",
          "evidence_refs": [
            "guide-pinout-detail-05"
          ],
          "functions": [
            "ARD"
          ],
          "number": 16,
          "signal_name": "VIN"
        }
      ]
    },
    {
      "connector_id": "J4",
      "display_name": "Arduino analog/DMIC expansion header J4",
      "evidence_refs": [
        "guide-pinout-overview-01",
        "guide-pinout-detail-05",
        "guide-pinout-detail-06"
      ],
      "pin_count": 12,
      "pins": [
        {
          "aliases": [],
          "electrical_role": "power_rail",
          "evidence_refs": [
            "guide-pinout-detail-05"
          ],
          "functions": [
            "DMIC"
          ],
          "number": 1,
          "signal_name": "P3V3"
        },
        {
          "aliases": [
            "ARD_A0"
          ],
          "electrical_role": "analog",
          "evidence_refs": [
            "guide-pinout-detail-05"
          ],
          "functions": [
            "ARD"
          ],
          "number": 2,
          "signal_name": "P4_6"
        },
        {
          "aliases": [],
          "electrical_role": "ground",
          "evidence_refs": [
            "guide-pinout-detail-05"
          ],
          "functions": [
            "DMIC"
          ],
          "number": 3,
          "signal_name": "GND"
        },
        {
          "aliases": [
            "ARD_A1"
          ],
          "electrical_role": "analog",
          "evidence_refs": [
            "guide-pinout-detail-05"
          ],
          "functions": [
            "ARD"
          ],
          "number": 4,
          "signal_name": "P4_15"
        },
        {
          "aliases": [],
          "electrical_role": "bus",
          "evidence_refs": [
            "guide-pinout-detail-05"
          ],
          "functions": [
            "DMIC"
          ],
          "number": 5,
          "signal_name": "P0_18"
        },
        {
          "aliases": [
            "ARD_A2"
          ],
          "electrical_role": "analog",
          "evidence_refs": [
            "guide-pinout-detail-05"
          ],
          "functions": [
            "ARD"
          ],
          "number": 6,
          "signal_name": "P4_16"
        },
        {
          "aliases": [],
          "electrical_role": "bus",
          "evidence_refs": [
            "guide-pinout-detail-05"
          ],
          "functions": [
            "DMIC"
          ],
          "number": 7,
          "signal_name": "P0_16"
        },
        {
          "aliases": [
            "ARD_A3"
          ],
          "electrical_role": "analog",
          "evidence_refs": [
            "guide-pinout-detail-05"
          ],
          "functions": [
            "ARD"
          ],
          "number": 8,
          "signal_name": "P4_17"
        },
        {
          "aliases": [],
          "electrical_role": "bus",
          "evidence_refs": [
            "guide-pinout-detail-05"
          ],
          "functions": [
            "DMIC"
          ],
          "number": 9,
          "signal_name": "P0_17"
        },
        {
          "aliases": [
            "ARD_A4"
          ],
          "electrical_role": "analog",
          "evidence_refs": [
            "guide-pinout-detail-05"
          ],
          "functions": [
            "ARD"
          ],
          "number": 10,
          "signal_name": "P4_12"
        },
        {
          "aliases": [],
          "electrical_role": "gpio",
          "evidence_refs": [
            "guide-pinout-detail-05"
          ],
          "functions": [
            "GPIO"
          ],
          "number": 11,
          "signal_name": "P5_7"
        },
        {
          "aliases": [
            "ARD_A5"
          ],
          "electrical_role": "analog",
          "evidence_refs": [
            "guide-pinout-detail-05"
          ],
          "functions": [
            "ARD"
          ],
          "number": 12,
          "signal_name": "P4_13"
        }
      ]
    },
    {
      "connector_id": "J2",
      "display_name": "Arduino digital/MC expansion header J2",
      "evidence_refs": [
        "guide-pinout-overview-01"
      ],
      "pin_count": 20,
      "pins": [
        {
          "aliases": [],
          "electrical_role": "gpio",
          "evidence_refs": [
            "guide-pinout-overview-01"
          ],
          "functions": [
            "MC"
          ],
          "number": 1,
          "signal_name": "P0_29"
        },
        {
          "aliases": [
            "ARD_D8"
          ],
          "electrical_role": "gpio",
          "evidence_refs": [
            "guide-pinout-overview-01"
          ],
          "functions": [
            "ARD"
          ],
          "number": 2,
          "signal_name": "P0_23"
        },
        {
          "aliases": [],
          "electrical_role": "gpio",
          "evidence_refs": [
            "guide-pinout-overview-01"
          ],
          "functions": [
            "MC"
          ],
          "number": 3,
          "signal_name": "P0_28"
        },
        {
          "aliases": [
            "ARD_D9"
          ],
          "electrical_role": "gpio",
          "evidence_refs": [
            "guide-pinout-overview-01"
          ],
          "functions": [
            "ARD"
          ],
          "number": 4,
          "signal_name": "P3_14"
        },
        {
          "aliases": [],